{  
   "bytes_in":28,
   "bytes_out":271,
   "client_ip":"192.168.0.1",
   "client_port":57522,
   "client_proc":"",
   "client_server":"macbook",
   "count":1,
   "dns":{  
      "additionals_count":0,
      "answers":[  
         {  
            "class":"IN",
            "data":"54.148.130.30",
            "name":"elastic.co",
            "ttl":59,
            "type":"A"
         },
         {  
            "class":"IN",
            "data":"54.69.104.66",
            "name":"elastic.co",
            "ttl":59,
            "type":"A"
         }
      ],
      "answers_count":2,
      "authorities":[  
         {  
            "class":"IN",
            "data":"j.root-servers.net",
            "name":"",
            "ttl":18336,
            "type":"NS"
         },
         {  
            "class":"IN",
            "data":"k.root-servers.net",
            "name":"",
            "ttl":18336,
            "type":"NS"
         },
         {  
            "class":"IN",
            "data":"h.root-servers.net",
            "name":"",
            "ttl":18336,
            "type":"NS"
         },
         {  
            "class":"IN",
            "data":"g.root-servers.net",
            "name":"",
            "ttl":18336,
            "type":"NS"
         },
         {  
            "class":"IN",
            "data":"l.root-servers.net",
            "name":"",
            "ttl":18336,
            "type":"NS"
         },
         {  
            "class":"IN",
            "data":"c.root-servers.net",
            "name":"",
            "ttl":18336,
            "type":"NS"
         },
         {  
            "class":"IN",
            "data":"a.root-servers.net",
            "name":"",
            "ttl":18336,
            "type":"NS"
         },
         {  
            "class":"IN",
            "data":"m.root-servers.net",
            "name":"",
            "ttl":18336,
            "type":"NS"
         },
         {  
            "class":"IN",
            "data":"d.root-servers.net",
            "name":"",
            "ttl":18336,
            "type":"NS"
         },
         {  
            "class":"IN",
            "data":"f.root-servers.net",
            "name":"",
            "ttl":18336,
            "type":"NS"
         },
         {  
            "class":"IN",
            "data":"b.root-servers.net",
            "name":"",
            "ttl":18336,
            "type":"NS"
         },
         {  
            "class":"IN",
            "data":"e.root-servers.net",
            "name":"",
            "ttl":18336,
            "type":"NS"
         },
         {  
            "class":"IN",
            "data":"i.root-servers.net",
            "name":"",
            "ttl":18336,
            "type":"NS"
         }
      ],
      "authorities_count":13,
      "flags":{  
         "authoritative":false,
         "recursion_allowed":true,
         "recursion_desired":true,
         "truncated_response":false
      },
      "id":46497,
      "op_code":"QUERY",
      "question":{  
         "class":"IN",
         "name":"elastic.co",
         "type":"A"
      },
      "response_code":"NOERROR"
   },
   "ip":"10.0.0.1",
   "method":"QUERY",
   "port":53,
   "proc":"",
   "query":"class IN, type A, elastic.co",
   "request":"ID 46497; QR query; OPCODE QUERY; FLAGS aa rd; RCODE NOERROR; QUESTION class IN, type A, elastic.co",
   "resource":"elastic.co",
   "response":"ID 46497; QR response; OPCODE QUERY; FLAGS rd ra; RCODE NOERROR; QUESTION class IN, type A, elastic.co; ANSWER elastic.co: ttl 59, class IN, type A, 54.148.130.30; elastic.co: ttl 59, class IN, type A, 54.69.104.66; AUTHORITY Root: ttl 18336, class IN, type NS, j.root-servers.net; Root: ttl 18336, class IN, type NS, k.root-servers.net; Root: ttl 18336, class IN, type NS, h.root-servers.net; Root: ttl 18336, class IN, type NS, g.root-servers.net; Root: ttl 18336, class IN, type NS, l.root-servers.net; Root: ttl 18336, class IN, type NS, c.root-servers.net; Root: ttl 18336, class IN, type NS, a.root-servers.net; Root: ttl 18336, class IN, type NS, m.root-servers.net; Root: ttl 18336, class IN, type NS, d.root-servers.net; Root: ttl 18336, class IN, type NS, f.root-servers.net; Root: ttl 18336, class IN, type NS, b.root-servers.net; Root: ttl 18336, class IN, type NS, e.root-servers.net; Root: ttl 18336, class IN, type NS, i.root-servers.net",
   "responsetime":77,
   "server":"",
   "shipper":"macbook",
   "status":"OK",
   "@timestamp":"2015-08-23T04:43:51.861Z",
   "transport":"udp",
   "type":"dns"
}
